<?xml version="1.0" encoding="UTF-8"?>
<Guess-Market xmlns:xsi="http://www.w3.org/2001/XMLSchema-instance" xsi:noNamespaceSchemaLocation="GM-EX1-schema.xsd">
	<GM-events>
		<GM-event name="Earth Quake on Dead Sea">
			<id>3</id>
			<description>Will there be an earth quake at the dead sea until December 31th 2026</description>
			<comision type="on-purchase">50</comision>
			<GM-options>
				<GM-option>Yes</GM-option>
				<GM-option>No</GM-option>
			</GM-options>
			<GM-method>
				<GM-LMSR>
					<b>100</b>
				</GM-LMSR>
			</GM-method>
		</GM-event>
	</GM-events>
</Guess-Market>
